id,question
633263,How can I control the rotation speed of a turret using `Quaternion.Slerp`?
633263,What is the purpose of `Time.deltaTime * 2000000` in the code snippet provided?
633263,Why does increasing the number after `Time.deltaTime` in the `Quaternion.Slerp` method only increase the speed up to a certain point?
633263,Can I adjust the rotation speed of the turret by changing the value of `rotationDegreesPerSecond`?
633263,Why is `transform.parent.Rotate` a simpler solution than using `Quaternion.Slerp`?
26162,How can I stop a C# coroutine that was started with `StartCoroutine(MyTimer(x))`?
26162,What are the different ways to stop a C# coroutine?
26162,"Can I stop a coroutine instantly, or does it need to finish its current iteration?"
26162,Is there a way to stop a coroutine based on a specific condition?
26162,What happens to a coroutine if the object it is attached to is destroyed?
896218,How can I make the player's speed increase gradually over time in my game?
896218,What is `rigidbody.angularVelocity` and how does it relate to my player's speed?
896218,How can I use the `maxAngularVelocity` setting in Project Settings to control the player's speed?
896218,"What is the formula `rotation = rotation + maxRotation * Time.deltaTime / levelDuration` used for, and how does it affect the player's speed?"
896218,How can I incorporate the incline of platforms into the player's speed increase?
121526,How can I animate my character model based on its facing direction and the movement of its parent?
121526,What are some common techniques for animating a character based on its movement and facing direction?
121526,Is there a way to use velocities to animate the character based on its movement and facing direction?
121526,What are some alternative ways to achieve the desired animation effect without relying on velocity-based animation?
121526,Can I use triggers to control the character's animation based on its facing direction and movement?
393491,How can I make a 3D model fade in and out in Unity?
393491,What shader should I use for fading in and out a 3D model?
393491,How can I use `Material.color` and `Color.Lerp` to achieve a smooth fade-in and fade-out effect?
393491,What code snippet can I use to implement a fade-in and fade-out effect on my 3D model?
393491,Can I control the speed of the fade-in and fade-out effect using `Color.Lerp`?
1218078,How can I get the player's X and Y coordinates in Unity using C#?
1218078,"How can I use the player's coordinates to determine if they are within a specific range, such as +/- 1 of the Thwomp's X coordinate?"
1218078,Is there a way to check if the player's X coordinate is within a range of the Thwomp's X coordinate without using direct equality comparison?
1218078,Can I use a script to track the player's position and trigger the Thwomp's movement based on their proximity?
1218078,What other methods can I use to make the Thwomp's movement more responsive to the player's position?
1776684,"Why is the console output for the `foreach` loop showing `Log(10,10,10,0,0,0)Finally`?"
1776684,Is the variable `QQ` the same as `Queue_List`?
1776684,Are there any other scripts that might be logging information to the console at the same time?
1776684,How can I distinguish the logs from this script from other logs in the console?
1776684,What is the purpose of using `gameObject` in the `Debug.Log` statement?
817772,Why is the image in my Oculus Rift DK2 offset to the left when running a Unity build?
817772,How can I check if my Unity project is properly configured to support the Oculus Rift DK2?
817772,Are there any specific settings in Unity's player settings that I need to adjust for the Oculus Rift DK2?
817772,"What is the recommended graphics API (e.g., DirectX 11) for the Oculus Rift DK2, and how do I configure it in Unity?"
817772,"Is it possible that the Oculus Rift DK2 SDK is not properly installed or configured, and if so, how can I fix it?"
1280801,Can I use decimal numbers as input for `Int32.TryParse()`?
1280801,What data type should I use to store decimal values in C#?
1280801,How can I convert a string containing a decimal number to a decimal value in C#?
1280801,Is there an equivalent of `Int32.TryParse()` for decimal values?
1280801,What are the differences between `Int32.TryParse()` and `float.TryParse()` in terms of input and output?
1662655,Why is the `Color.Lerp` function not producing the desired color interpolation effect?
1662655,"What is the purpose of the `t` variable in the code, and how is it supposed to control the interpolation?"
1662655,How does `Time.deltaTime` affect the interpolation process?
1662655,What is the correct way to use `Color.Lerp` to achieve a smooth and continuous color transition?
1662655,Are there any other methods or functions in Unity that I can use to achieve the desired color interpolation effect?
33968,Why is the debug button in MonoDevelop missing or disabled?
33968,How do I configure the path to my Unity installation in MonoDevelop?
33968,Is there a way to attach the MonoDevelop debugger to a running Unity session?
33968,What are the steps to enable debugging in Unity and MonoDevelop?
33968,"If the debug button is still missing after checking the preferences, what other troubleshooting steps should I take?"
626125,How can I scale the texture applied to a terrain in Unity?
626125,Is there a way to adjust the texture scale independently from the terrain's size?
626125,Can I use the terrain's paint brush tool to control the texture scale?
626125,What are the different ways to manipulate texture scaling on terrains in Unity?
626125,Are there any limitations or considerations when scaling textures on terrains?
482620,How can I make a `GUI.Label` display text in italics?
482620,What property of the `GUIStyle` object controls the font style?
482620,"Are there other font styles available besides italics, and how do I apply them?"
482620,Can I change the font style of a `GUI.Label` at runtime?
482620,Is it possible to apply different font styles to different parts of the text in a `GUI.Label`?
1372362,Why is only the earliest instantiated clone being affected by the trigger event?
1372362,How can I make the trigger event affect only one specific clone among multiple clones?
1372362,"What is the difference between using the ""Shield Reflect"" prefab and the ""Orb Bullet"" prefab in collision detection?"
1372362,Is there a way to differentiate between individual clones within the trigger event?
1372362,What are some alternative approaches to applying an effect to a specific clone upon trigger?
216598,How can I create a visual reference of a building while the player is moving the mouse over the terrain?
216598,What techniques can I use to make a building reference follow the mouse cursor?
216598,Is there a way to create a transparent or ghost version of the building for the reference?
216598,How can I handle the placement of the building when the player clicks on the terrain?
216598,Are there any pre-built assets or libraries available to simplify building placement with visual references in Unity?
278014,How can I make the particle trail texture rotate to face the moving object?
278014,What settings in the Shuriken particle system can I use to control the rotation of the particle billboards?
278014,Can I use a script to dynamically rotate the particle billboards based on the object's movement direction?
278014,Is there a way to align the particle trail texture to the object's movement direction using local coordinates?
278014,What are some common techniques for creating directional particle trails in Unity?
